caption,image_file
A photograph of an orange car in front of a building with enkei RPF1 wheels,Image_1024px-frame-2.jpg
A photograph of an grey car in front of some trees with enkei RPF1 wheels,Image_1024px-frame-3.jpg
A photograph of an black car in front of some trees with enkei RPF1 wheels,Image_1024px-frame-4.jpg
A photograph of an black car in front of a dock with enkei RPF1 wheels,Image_1024px-frame-5.jpg
A photograph of an yellow car with enkei RPF1 wheels,Image_1024px-frame-6.jpg
A photograph of an black car in front of a building with enkei RPF1 wheels,Image_1024px-frame-7.jpg
A photograph of an black car in a parking lot with enkei RPF1 wheels,Image_1024px-frame.jpg